acronym	name	description	homepage	contact	released	administeredBy
ISO19115DTC	ISO 19115 Date Type Code	ISO 19115 Date Type Codes		Kim Durante	2017-07-17T00:00:00.000+00:00	https://data.bioontology.org/users/kdurante
ONL-MR-DA	Magnetic Resonance Dataset Acquisition Ontology	This ontology is a module of the OntoNeuroLOG ontology, developed in the context of the NeuroLOG project, a french project supported by ANR (ANR-06-TLOG-024 grant) aiming at integrating distributed heterogeneous resources in neuroimaging.\r\nIf covers the domain of Magnetic Resonance Imaging (MRI) dataset acquisition, i.e. MRI protocols, and MRI sequence parameters. In particular, it includes a multi-axial classification of MR sequences.	http://neurolog.unice.fr/ontoneurolog/v3.0/Documentation_OntoNeuroLOGv3.pdf	Bernard Gibaud	2013-07-10T00:00:00.000-07:00	https://data.bioontology.org/users/bgibaud
MISO	Microbial Isolation Source Ontology	This ontology aims to classify and tag microbial isolation sources, which are often only provided as free-text commentaries, to improve their accessibility and usability.		Julia Koblitz	2025-06-16T18:09:06.000-07:00	https://data.bioontology.org/users/JKoblitz
CTENO	Ctenophore Ontology	An anatomical and developmental ontology for ctenophores (Comb Jellies)	https://github.com/obophenotype/ctenophore-ontology	Chris Mungall	2016-10-19T00:00:00.000+00:00	https://data.bioontology.org/users/vendetti
MSR	Mammography screening recommendation	This is an ontology that represents a variety of entities and classifications that share the knowledge of the recommendations provided by the guideline from the American Cancer Society on Breast Cancer Screening for Women at Average Risk.\r\n\r\nThis ontology was developed as part of an ontology course on UdelaR Univeristy. Mentored by Regina Motz and Edelweis Rohrer		Yasmine Anchén	2022-12-04T00:00:00.000+00:00	https://data.bioontology.org/users/cindy-a
BIPOM	Biological interlocked Process Ontology for metabolism	BiPOm is an ontology based on systemic representation of metabolic processes. BiPOm is an ontological model carrying the main biological processes and molecular roles/functions at a high level of genericity where the usual annotated resources are treated as instances.\r\nBiPOm, 1) contains biological knowledge as instances and 2) uses automatic reasoning through Semantic Web Rule Language (SWRL) in order to automatically infer, formalize and refine properties of molecules.		Anne Goelzer	2020-04-15T00:00:00.000+00:00	https://data.bioontology.org/users/VJHenry
LOINC	Logical Observation Identifier Names and Codes	Logical Observation Identifier Names and Codes (LOINC) provides formal names and standardized codes for laboratory and other clinical observations. The data cover laboratory terminology, vital signs, hemodynamics intake/output, EKG, obstetric ultrasound, cardiac echo, urologic, imaging, gastroendoscopic procedures, pulmonary ventilator management, and selected survey instruments.	http://loinc.org/downloads	LOINC Support	2024-11-04T00:00:00.000+00:00	https://data.bioontology.org/users/admin
ENTITY	ISO-15926-2_2003_entityMembership	Entity Membership		Nitin	2016-01-08T00:00:00.000+00:00	https://data.bioontology.org/users/Sun+Pharma
RADLEX	Radiology Lexicon	RadLex OWL, as downloaded from BioPortal, includes a set of puns in order to facilitate browsing and display.  For the base RadLex ontology alone, without puns,  and release notes for the latest version, please see http://radlex.org/	https://www.rsna.org/practice-tools/data-tools-and-standards/radlex-radiology-lexicon	Radiological Society of North America	2020-11-25T00:00:00.000+00:00	https://data.bioontology.org/users/rboden
VIO	Vaccine Investigation Ontology	VIO is an VO-extended ontology with the aim to standardize the metadata types in various vaccine investigation studies.	https://github.com/vaccineontology/VIO	Yongqun He	2019-04-29T00:00:00.000+00:00	https://data.bioontology.org/users/yongqunh%40med.umich.edu;https://data.bioontology.org/users/e4ong1031
MCO4MCRE	Multiplex Classification Ontology for the MultiCaRe Experiment	Ontology used for one of the experiments from the Multiplex Classification Framework (paper under review). This ontology is based on the set of classes from the MultiCaRe dataset. The MultiCaRe dataset is a multimodal case report dataset containing medical images that were programmatically labeled based on the content of their captions (Nievas Offidani & Delrieux, 2024). Images may have more than one label, making this a multi-label classification task. For this experiment, we selected a subset of 31 classes, including “endoscopy”, “colonoscopy”, and “mri”. The original ontology is flat, and it does not contain any logical constraints among the classes. Data Article: Nievas Offidani, M. A., & Delrieux, C. A. (2024). Dataset of clinical cases, images, image labels and captions from open access case reports from PubMed Central (1990–2023). Data in Brief, 52, 110008. https://doi.org/10.1016/j.dib.2023.110008		Mauro Nievas Offidani	2024-09-07T00:00:00.000+00:00	https://data.bioontology.org/users/mauro.nievasoffidani
RDL	RDL	RDL		Nitin	2016-01-08T00:00:00.000+00:00	https://data.bioontology.org/users/Sun+Pharma
SURGICAL	Nurse Surgical	This is an ontology of a surgical nurse's process domain		Philip Shields	2015-09-24T00:00:00.000+00:00	https://data.bioontology.org/users/shielphi
RADXTT-MVREASONS	RADx Tiger Team Missing Value Reasons	These concepts define the different reasons values might be missing from the RADx data record. The concepts have been approved by the RADx Executive Committee to fill in fields that do not have a value in them. \r\n\r\nThe concepts in this vocabulary were developed by the RADx Missing Values Tiger Team. The protocols for managing these concepts in the RADx Data Hub environment are still being developed and will be improved and described as part of the RADx program.	https://github.com/bmir-radx/radx-missing-value-reasons	John Graybeal	2023-10-24T18:22:12.000-07:00	https://data.bioontology.org/users/mhorridge;https://data.bioontology.org/users/marcos.martinez;https://data.bioontology.org/users/matthewhorridge
OMCO	OligoMetastatic Cancer Ontology	The OligoMetastatic Cancer Ontology(OMCO) is a disease-specific ontology that characterizes the knowledge field of oligometastatic cancer.		Rongrong Wu	2025-03-03T00:00:00.000+00:00	https://data.bioontology.org/users/Alice
BPT	Biological Pathway Taxonomy	Biological Pathway Taxonomy (BPT) - hierarchical taxonomy of cellular and molecular mechanisms, metabolic reactions, and diseases that can be shown as signaling pathways. BPT was created manually based on the Elsevier Pathway Collection available for public usage.\r\n\r\n There are 3 types of entities in BPT – pathway, group, and folder of pathways and groups. \r\n Group is the list of genes and proteins associated with biological function and diseases. \r\n Pathway is an interactive model of molecular interactions in human and mammalian cells described in the literature. Each model was reconstructed based on facts published in peer-reviewed journals, with manually quality control.\r\n\r\n BPT pathway entity includes several properties such as link to the model in Pathway Studio software which allows reading supported sentences from published articles and additional information about members. A list of members for each model can be provided by request. Property “network” describes maps without logical causal relationships between members to distinguish them from actual models of molecular mechanisms (“signaling”).\r\n\r\n The index folder contains all pathways and groups sorted alphabetically.		Anastasia Nesterova	2022-03-29T00:00:00.000+00:00	https://data.bioontology.org/users/a.nesterova
CHO	ChemoOnto	ChemoOnto, an ontology to qualify the course of chemotherapies		Alice Rogier	2023-12-06T00:00:00.000+00:00	https://data.bioontology.org/users/AliceR;https://data.bioontology.org/users/coulet
BMT	Biomedical Topics	An ontology of biological and biomedical topics, created from merging the EDAM Topics sub-ontology with auxiliary topics that are out of scope of EDAM.		Jon Ison	2014-10-06T00:00:00.000+00:00	https://data.bioontology.org/users/jon
UPHENO	Combined Phenotype Ontology	Combined phenotype ontology, The Unified Phenotype Ontology (uPheno) is an ontology that integrates other species-specific phenotype ontologies.		Chris Mungall	2025-10-12T18:14:25.000-07:00	https://data.bioontology.org/users/vendetti
WEAVE	WEAVE: Wind Energy ActiVitiEs	\r\nControlled vocabularies such as taxonomies allow an accurate and controlled approach in describing datasets. One of such controlled vocabulary is Wind Energy Taxonomy of Activities. This taxonomy is the result of EERA JP WIND IRPWind Open Data initiative that took place in 2017 in which wind energy experts generated the first version of the taxonomy as an input for defining and structuring wind energy metadata.\r\n\r\nThe report of this work is available at Zenodo: https://www.zenodo.org/record/1199489#.XSD6haeQ3RY\r\n\r\nIn 2018, the taxonomy of topics was improved during the internal project of DTU Wind Energy titled 'FAIR Digitalization': https://www.zenodo.org/record/1493874#.XSD7TaeQ3RY\r\n\r\nIn 2021, the taxonomy was converted into FAIR machine-actionable controlled vocabulary using sheet2rdf. The controlled vocabulary is served to humans and machines using an instace of OntoStack hosted by DTU Wind Energy. sheet2rdf and OntoStack are developed by FAIR Data Collective.\r\n\r\nAdditionally, in 2021, the persistent URL purl.org/weave has been registered for the taxonomy. This allows us to:\r\n\r\nIf there is a needed to move the taxonomy to another domain (currently under data.windenergy.dtu.dk) URLs will be still resolvable and unchanged\r\nUse short URls as PIDs for the taxonomy terms and properties such as:\r\npurl.org/weave/Measurements	https://github.com/DTUWindEnergy/WEAVE-taxonomy#weave-wind-energy-activities	Nikola Vasiljevic	2023-05-23T18:29:52.000-07:00	https://data.bioontology.org/users/niva
PLANA	Planarian Anatomy and Developmental Stage Ontolgoy	Anatomy ontology for planaria and terms specific to the developmental stages of the planarian Schmidtea mediterranea.	https://github.com/obophenotype/planaria-ontology	Sofia Robb	2023-03-13T18:14:19.000-07:00	https://data.bioontology.org/users/smr
MNR	Material Natural Resource 	Natural Resource		Nitin	2016-01-08T00:00:00.000+00:00	https://data.bioontology.org/users/Sun+Pharma
ELIG	Eligibility Feature Hierarchy	We derived a set of 1,437 eligibility features that were organized into a feature hierarchy using 80 breast cancer trials. 		Mary Regina Boland	2013-05-07T00:00:00.000-07:00	https://data.bioontology.org/users/mab7036
VARIO	Variation Ontology	Variation Ontology, VariO, is an ontology for standardized, systematic description of effects, consequences and mechanisms of variations.\r\n\r\nOntology is unreachable as of 2024, but continues to be available on BioPortal as a retired ontology. 	http://variationontology.org	Mauno Vihinen	2020-09-04T00:00:00.000+00:00	https://data.bioontology.org/users/graybeal
PORO	Porifera Ontology	An ontology covering the anatomy of Porifera (sponges)		Bob Thacker	2021-11-08T18:11:03.000-08:00	https://data.bioontology.org/users/thackeruab
ASDPTO	Autism Spectrum Disorder Phenotype Ontology	Autism Spectrum Disorder Phenotype Ontology encapsulates the Autism Spectrum Disorder behavioral phenotype, informed by the standard ASD assessment instruments and the currently known characteristics of this disorder.\r\nhttp://www.ncbi.nlm.nih.gov/pubmed/24163114		Alexa T McCray	2014-01-21T00:00:00.000+00:00	https://data.bioontology.org/users/ptrevvett
SOY	Soy Ontology	Growth, trait and development ontology for soybean	http://soybase.org	Rex Nelson	2013-04-30T00:00:00.000+00:00	https://data.bioontology.org/users/maxglycine;https://data.bioontology.org/users/graybeal
CRO	Contributor Role Ontology	The Contributor Role Ontology (CRO) is an extension of the CASRAI Contributor Roles Taxonomy (CRediT).	https://github.com/data2health/contributor-role-ontology	Marijane White	2019-12-11T18:04:23.000-08:00	https://data.bioontology.org/users/marijane
LEGALAPA	legalapa	this is a test with the legal cluster of apa ontology		alexander garcia	2014-12-19T00:00:00.000+00:00	https://data.bioontology.org/users/APA;https://data.bioontology.org/users/alexgarciac
DEB	Devices, Experimental scaffolds and Biomaterials Ontology	An ontology developed to facilitate information curation in the area of medical devices, experimental scaffolds and biomaterials. The ontology was designed to complement existing medical vocabularies, with emphasis on material processing, structures and features associated with biomaterials and experimental scaffolds. It is used as part of an automated text mining pipeline which populates the database of Experimental Biomaterials and their Biological Effect (DEBBIE). \r\nDEBBIE is an EU Horizon 2020 funded project. For more information visit https://projectdebbie.github.io/ 	https://projectdebbie.github.io/	Osnat Hakimi	2021-06-02T00:00:00.000+00:00	https://data.bioontology.org/users/osnat.hakimi
APRO	Ancient Poet Resource Ontology	APRO（Ancient Poet Resource Ontology）是一个旨在系统性地组织和描述与中国古代诗人及其作品相关信息的本体。本体覆盖了古代诗人的生平、作品、历史背景和相关事件，以及与其作品相关的情感和风格特征。通过集成历史、文学和文化研究的元素，APRO提供了一个丰富的框架，用于分析和探索中国古代诗歌的丰富性和复杂性。\r\n\r\n主要特点和组件包括：\r\n\r\n人物类：包含古代诗人的基本信息，如姓名、字、号、出生和逝世日期，以及他们的主要成就和生平事件。\r\n作品类：详细描述了诗人的主要作品，包括作品名称、创作时间、体裁、主题和风格。\r\n事件类：记录了与诗人和其作品相关的重要历史事件。\r\n情感类：涵盖了作品中表达的情感倾向和风格特征。\r\n资源类：涉及与诗人及其作品相关的各类资源，如文献、研究文章和教育材料。\r\n时间和地点类：详细说明了诗人活动的时间和地点，以及作品的创作背景。\r\nAPRO本体适用于文学研究者、历史学家、教育工作者以及对中国古代诗歌感兴趣的人士，用于教学、学术研究和文化传承。本体的设计充分考虑了易用性和扩展性，支持跨领域的查询和分析。\r\n\r\nAPRO (Ancient Poet Resource Ontology) is an ontology designed to systematically organize and describe information related to ancient Chinese poets and their works. The ontology encompasses the life, works, historical context, and related events of ancient poets, as well as emotional and stylistic characteristics associated with their works. Integrating elements of historical, literary, and cultural studies, APRO provides a rich framework for analyzing and exploring the richness and complexity of ancient Chinese poetry.\r\n\r\nKey features and components include:\r\n\r\nPerson Class: Contains basic information about ancient poets, such as their names, courtesy names, art names, birth and death dates, major achievements, and life events.\r\nWork Class: Details the main works of the poets, including the name of the work, time of creation, genre, theme, and style.\r\nEvent Class: Records significant historical events related to the poets and their works.\r\nEmotion Class: Covers the emotional tendencies and stylistic features expressed in the works.\r\nResource Class: Pertains to various resources associated with the poets and their works, such as literature, research papers, and educational materials.\r\nTime and Place Class: Specifies the times and places of the poets' activities, as well as the background of the creation of their works.\r\nThe APRO ontology is suitable for literary researchers, historians, educators, and anyone interested in ancient Chinese poetry, for use in teaching, academic research, and cultural heritage preservation. The design of the ontology takes into account ease of use and extensibility, supporting cross-disciplinary queries and analysis.		Qiang Zhang	2023-12-15T00:00:00.000+00:00	https://data.bioontology.org/users/zhangqiang2020
ICPS	International Classification for Patient Safety	Ontology network about Patient Safety Incident. This work has been carried out by the Ontological Engineering Group, using sources from the University of Saint Etienne and the Australian Patient Safety Foundation, and supported by the World Health Organisation under the International Classification for Patient Safety programme.	http://www.oeg-upm.net/	Oscar Corcho	2010-06-28T00:00:00.000-07:00	https://data.bioontology.org/users/ocorcho
CABRO	Computer Assisted Brain Injury Rehabilitation Ontology	a web ontology for the semantic representation of the computer assisted brain trauma rehabilitation domain. This is a novel and emerging domain, since it employs the use of robotic devices, adaptation software and machine learning to facilitate interactive, adaptive and personalized rehabilitation care, patient monitoring and assisted living. 		Dimitrios Zikos	2013-03-01T00:00:00.000-08:00	https://data.bioontology.org/users/dimitriszikos
HELIFIT	HeLiFit-Ontology	This an ontology for healthcare.		Carlo Allocca	2022-12-13T00:00:00.000+00:00	https://data.bioontology.org/users/carloallocca
I2SV	Integration and Implementation Sciences Vocabulary	Terms used to describe research concepts, methods and processes for addressing complex societal and environmental problems, especially investigations involving integration across different disciplinary and stakeholder perspectives, as well as implementation of findings into policy and practice change. The terms were originally developed for the Integration and Implementation Insights blog (http://i2Insights.org).	https://i2insights.org/index/integration-and-implementation-sciences-vocabulary/	Gabriele Bammer	2021-04-14T00:00:00.000+00:00	https://data.bioontology.org/users/i2s
OCHV	Ontology of Consumer Health Vocabulary	A SKOS-encoded implementation of  the "Open Access, Collaborative Consumer Health Vocabulary Initiative" by the University of Utah (consumerhealthvocab.org and layhealthinformatics.com)		Tuan Amith	2016-01-21T00:00:00.000+00:00	https://data.bioontology.org/users/MFAmith;https://data.bioontology.org/users/taocui
GRO-CPD	Cereal Plant Development Ontology	A structured controlled vocabulary for describing cereal plant development and growth stages. Please note that this ontology has now been superseded by the Plant Ontology.\r\n	http://www.gramene.org/plant_ontology/	Plant Ontology Administrators	2007-08-24T00:00:00.000+00:00	https://data.bioontology.org/users/cooperl
NIFSUBCELL	Neuroscience Information Framework (NIF) Subcellular Ontology	http://ontology.neuinfo.org/NIF/BiomaterialEntities/NIF-Subcellular.owl		Tom Gillespie	2012-05-31T00:00:00.000+00:00	https://data.bioontology.org/users/smtifahim;https://data.bioontology.org/users/tgbugs;https://data.bioontology.org/users/graybeal
NMOSP	NeuroMorpho.Org species ontology	The species ontology of NeuroMorpho.Org was updated (OntoSearch v1.3) to map the new species and strains added in  NeuroMorpho.Org v6.3 release.	http://NeuroMorpho.Org	Sridevi Polavaram	2019-11-22T18:12:34.000-08:00	https://data.bioontology.org/users/NeuroMorpho.Org
FB-DV	Drosophila Development Ontology	A structured controlled vocabulary of the development of <i>Drosophila melanogaster</i>.	http://sourceforge.net/p/fbbtdv/wiki/Home/	Marta Costa	2025-10-16T18:09:07.000-07:00	https://data.bioontology.org/users/mmc46;https://data.bioontology.org/users/obo-anatomy%40lists.sourceforge.net
CHIRO	CHEBI Integrated Role Ontology	CHEBI provides a distinct role hierarchy. Chemicals in the structural hierarchy are connected via a 'has role' relation. CHIRO provides links from these roles to useful other classes in other ontologies. This will allow direct connection between chemical structures (small molecules, drugs) and what they do. This could be formalized using 'capable of', in the same way Uberon and the Cell Ontology link structures to processes.	https://github.com/obophenotype/chiro	Nicole Vasilevsky	2015-11-23T00:00:00.000+00:00	https://data.bioontology.org/users/vendetti
HAMIDEHSGH	Inherited Retinal Dystrophy	Inherited retinal dystrophy (IRD) as one of the rare ocular diseases encompasses different types of hereditary retinal degenerations appearing by involvement of the different layers of the posterior ocular segment. In respect of the importance of the classification systems regarding the recorded history of biologic and natural sciences, there is no classification regarding the IRD diagnoses. Therefore, we aimed to present a novel classification in this regard.		Hamideh Sabbaghi	2019-07-10T00:00:00.000+00:00	https://data.bioontology.org/users/Sabbaghi.opt%40gmail.com
MIM	Molecular Interaction Map	The Molecular Interaction Map (MIM) notation seeks to provide a standardized method to draw diagrams for bioregulatory networks with features similar to technical diagrams in other fields.\r\n\r\nThis vocabulary uses the term hierarchy from the Formal MIM Notation Specification. Where possible, Systems Biology Ontology (SBO) and Biological Pathway Exchange (BioPAX) terms and IRIs are used. If no SBO or BioPAX term is available, a new term and IRI are created.\r\n\r\nThis is currently only a partial implementation. Many elements still need to be added to cover the full the specification.	http://discover.nci.nih.gov/mim/	Anders Riutta	2014-10-30T00:00:00.000+00:00	https://data.bioontology.org/users/AlexanderPico;https://data.bioontology.org/users/wikipathways;https://data.bioontology.org/users/egonw
SEPON	Sepsis Ontology	The Sepsis Ontology (SEPON) is a disease-specific ontology that defines the concepts and relationships between concepts in the field of sepsis and related diseases, contributing to data standardization and providing precise and personalized diagnosis, treatment and prognosis recommandations for sepsis.		ZHANG CHI	2024-05-14T00:00:00.000+00:00	https://data.bioontology.org/users/zc1995
TMA	Tissue Microarray Ontology	Tissue microarrays (TMA) are enormously useful tools for translational research, but incompatibilities in database systems between various researchers and institutions prevent the efficient sharing of data that could help realize their full potential.  The Resource Description Framework (RDF) provides a flexible method to represent knowledge in triples, which take the form Subject-Predicate-Object.  All data resources are described using Uniform Resource Identifiers (URI), which are global in scope.  We present an OWL (Web Ontology Language) schema that expands upon the TMA data exchange specification to address this issue and assist in data sharing and integration.		Chuck Borromeo	2010-05-07T00:00:00.000-07:00	https://data.bioontology.org/users/cborromeo
TIMEBANK	Timebank Ontology	The Timebank Ontology is used to describe Timebank systems for Peer-to-Peer Service Exchange. A Timebank allows user to store virtual money, often called a Time Dollar, into a bank account. This virtual currency can be earned by helping fellow Timebank users and spent by requesting help from others. The main goal of the ontology is to facilitate the matching between helpers and requesters of help.	https://w3id.org/timebank	Tobias Grubenmann	2020-08-05T00:00:00.000+00:00	https://data.bioontology.org/users/tobias.grubenmann
NERO	Named Entity Recognition Ontology 	Named Entity Recognition Ontology (NERO) developed specifically for describing textual entities in biomedical texts, which accounts for diverse levels of ambiguity, bridging the scientific sublanguages of molecular biology, genetics, biochemistry, and medicine. The annotation of natural science texts is more challenging than in other domains. Biomedical language is replete with ambiguity distinct from that observed in news articles or informal text online. In biomedical texts, alternative meanings are not always clearly separated.\r\n\r\nFor example, in some biomedical contexts, the words for a named entity may refer to a gene or a protein with nearly equal probability; for example, “a mutant hemoglobin α_2” can refer to either a gene or a protein. If the author meant gene-or-protein A, and we force an annotator to choose either interpretation gene A or protein A, the resulting annotation is of limited utility because the choice between gene and protein is random if the meanings are equally likely based on context. NERO attempts to minimize unwarranted, arbitrary annotative semantic label assignments for textual entities. \r\n\r\nNERO defines ambiguous concepts, such as GeneOrProtein, which subsumes both Gene and Protein using the following axiom: EquivalentTo: ‘Gene’ or ‘Protein.’ There are no biological entities that are either a gene or a protein, but there are lexical entities that can correspond to either or both of these entities.\r\n		Prof. Robert Stevens	2021-04-28T00:00:00.000+00:00	https://data.bioontology.org/users/Larisa
N-CDOH	Non Clinical Determinants of Health	Supporting ontology reuse by integrating CDoH with an existing SDoH ontology. We are presenting an overarching conception for all non-clinical determinants of health (N-CDoH).		Navya	2023-03-14T00:00:00.000+00:00	https://data.bioontology.org/users/vipinakk;https://data.bioontology.org/users/Navya;https://data.bioontology.org/users/geller
OCD	OCD ontology	The Obsessive Compulsive Disorder Ontology (OCD) is a domain-specific ontology for representing the knowledge of OCD.		Areej 	2022-12-21T00:00:00.000+00:00	https://data.bioontology.org/users/Areej+Nasser
