acronym	name	description	homepage	contact	released	administeredBy
REX	Physico-Chemical Process	REX is an ontology of physico-chemical processes, i.e. physico-chemical changes occurring in course of time. REX includes both microscopic processes (involving molecular entities or subatomic particles) and macroscopic processes. Some biochemical processes from Gene Ontology (GO Biological process) can be described as instances of REX.	http://www.ebi.ac.uk/~kirill/REX/	Chebi Administrators	2011-02-15T00:00:00.000-08:00	https://data.bioontology.org/users/chebi-help%40ebi.ac.uk
REXO	Regulation of Gene Expression Ontolology	An application ontology for the domain of gene expression regulation. The ontology integrates fragments of GO and MI with data from GOA, IntAct, UniProt, NCBI,  and orthology relations using ontological properties from RO and ISO.	http://www.semantic-systems-biology.org/apo	Vladimir Mironov	2015-12-16T00:00:00.000+00:00	https://data.bioontology.org/users/vlmir
FYPO	Fission Yeast Phenotype Ontology	Fission Yeast Phenotype Ontology, A formal ontology of phenotypes observed in fission yeast.	https://github.com/pombase/fypo	Valerie Wood	2025-09-27T18:06:47.000-07:00	https://data.bioontology.org/users/Val++Wood
DOREMUS-KEYS	Doremus List of Keys	The sum of relations, melodic and harmonic, existing between the tones of a scale or musical system.		Nancy Lorimer	2018-06-30T00:00:00.000+00:00	https://data.bioontology.org/users/nlorimer
PATHLEX	Anatomic Pathology Lexicon	PathLex, a comprehensive lexicon—a unified language of anatomic pathology terms—for standardized indexing and retrieval of anatomic pathology information resources. 		Christel Daniel	2013-01-22T00:00:00.000-08:00	https://data.bioontology.org/users/ouagne
BCO	Biological Collections Ontology	BCO supports the interoperability of biodiversity data, including data on museum collections, environmental/metagenomic samples, and ecological surveys. A key feature of BCO is an ontological interpretation of Darwin Core terms.	https://github.com/BiodiversityOntologies/bcom/p/bco/	bco-discuss list	2021-11-14T18:00:37.000-08:00	https://data.bioontology.org/users/rwallls
BCON	Breast Cancer Ontology	The Breast Cancer Ontology (BCON) aims to capture the diverse aspects of breast cancer, including its molecular biology, pathology, epidemiology, clinical data, and lifestyle factors. By representing this knowledge in a standardized and machine-readable format, the ontology enables researchers, clinicians, and other stakeholders to access, share, and analyze breast cancer-related information more effectively. It serves as a valuable resource for organizing existing knowledge, discovering new insights, and supporting decision-making processes in the field of breast cancer research and healthcare.		Hui Zong	2024-01-02T00:00:00.000+00:00	https://data.bioontology.org/users/Hui+Zong
TAXRANK	Taxonomic Rank Vocabulary	A vocabulary of taxonomic ranks intended to replace the sets of rank terms found in the Teleost Taxonomy Ontology, the OBO translation of the NCBI taxonomy and similar OBO taxonomy ontologies.  It provides terms for taxonomic ranks drawn from both the NCBI taxonomy database and from a rank vocabulary developed for the TDWG biodiversity information standards group.  Cross references to appearances of each term in each source are provided.  Consistent with its intended use as a vocabulary of labels, there is no relation specifying an ordering of the rank terms.	https://www.phenoscape.org/wiki/Taxonomic_Rank_Vocabulary	Peter Midford	2025-09-24T18:17:10.000-07:00	https://data.bioontology.org/users/peteremidford%40yahoo.com
VICO	Vaccination Informed Consent Ontology	The Vaccination Informed Consent Ontology (VICO) is a community-driven ontology in the domain of vaccination/immunization informed consent.	https://github.com/VICO-ontology	Oliver He	2016-01-30T18:14:05.000-08:00	https://data.bioontology.org/users/yongqunh%40med.umich.edu;https://data.bioontology.org/users/linikujp
BT-ONTOLOGY	BrainTeaser Ontology (BTO)	BrainTeaser Ontology (BTO) whose purpose is to jointly model both Amyotrophic Lateral Sclerosis (ALS) and Multiple Sclerosis (MS).\r\n\r\nThe BTO serves multiple purposes:\r\n\r\n- to provide a unified and comprehensive conceptual view about ALS and MS, which are typically dealt with separately, allowing us to coherently integrate the data coming from the different medical partners in the project;\r\n- to seamlessly represent both retrospective data and prospective data, produced during the lifetime of BRAINTEASER\r\n- to allow for sharing and re-using the BRAINTEASER datasets according to Open Science and FAIR principles.\r\n\r\nFor more details, visit the BTO documentation page: https://brainteaser.dei.unipd.it/ontology/	https://brainteaser.dei.unipd.it/ontology/	Stefano Marchesin	2024-07-21T18:00:44.000-07:00	https://data.bioontology.org/users/gfaggioli
ISO-ANNOTATIONS	ISO-15926-2_2003_annotations	Oil and Gas Annotations		Nitin	2016-01-09T00:00:00.000+00:00	https://data.bioontology.org/users/Sun+Pharma
EPILONT	Epilepsy Ontology	Ontology about the epilepsy domain and epileptic seizures. Based on the diagnosis proposed by the International League Against Epilepsy (ILAE).	http://www.epilepsiae.eu	Antonio Dourado	2011-07-18T00:00:00.000-07:00	https://data.bioontology.org/users/epilepsiae
FDT-O	FAIR Data Train Ontology	The FAIR Data Train Ontology provides the definitions of concepts and relations used in the FAIR Data Train environment.		Luiz Bonino	2022-11-30T18:04:59.000-08:00	https://data.bioontology.org/users/lolavo
HERO	Healthcare Monitoring and Emergency Response Ontology	This ontology is designed to support a healthcare monitoring system that leverages wearable devices and Semantic Web technologies to continuously monitor patient vital signs, assess their medical conditions, and provide timely alerts and interventions in case of abnormalities or emergencies. It aims to enhance patient care, safety, and decision-making by integrating ontology-based reasoning, SWRL rules, and real-time data from various sources.\r\n\r\nMain Features:\r\n- Integration of Diverse Data Sources: The ontology integrates different data models like FHIR (for electronic health records and medical data), SOSA (for sensor data and vital signs), and FOAF (for patient profile management). This integration allows for a comprehensive representation of both static and dynamic patient data, supporting more accurate monitoring and decision-making.\r\n\r\n- Vital Sign Monitoring: It includes classes and properties for representing vital signs such as Temperature, Blood Pressure, Heart Rate, Respiratory Rate, and Oxygen Saturation. Each vital sign is associated with corresponding observations and results, following the SOSA ontology pattern.\r\n\r\n- Health Condition Assessment: The ontology defines multiple classes to represent different health conditions:\r\n  1- Normal Situation: Represents a state where all monitored vital signs fall within their normal ranges.\r\n   2- Abnormal Situation: Represents a state where one or more vital signs fall outside their normal range, but there is no indication of device \r\n       malfunction.\r\n  3- Wrong Situation: Represents a condition where at least one vital sign is classified as "wrong," indicating a possible malfunction of the wearable \r\n      device. This triggers alerts to the patient to check or repair the device.\r\n- Emergency and Critical Emergency Handling: In abnormal situations, SWRL rules are used to infer whether the situation is an emergency or a critical emergency:\r\n  Emergency Situation: Requires additional evaluation by healthcare providers. If the situation matches a previously stored case, the system \r\n  retrieves and recommends the previous prescription. Otherwise, a "risky alarm" is generated, and the patient's current and historical data are \r\n  reviewed to make clinical decisions.\r\n Critical Emergency Situation: In such cases, the system immediately alerts the emergency center, dispatches the nearest ambulance, and informs \r\n  the hospital of the patient's condition and estimated arrival time.\r\n  SWRL Rules for Decision Making: The ontology utilizes SWRL rules to automate reasoning processes for determining the patient's condition based on real-time data. These rules help classify patient situations into normal, abnormal, or critical states, enhancing the responsiveness of the healthcare system.\r\n\r\nEmergency Response Workflow: The ontology supports a detailed emergency response workflow, which involves identifying the nearest hospital, dispatching an ambulance, informing the ambulance crew, alerting the receiving hospital, and continuously updating the patient with the ambulance's status.\r\n\r\nRange and Classification Definitions: The ontology defines ranges for normal, abnormal, and wrong values for each vital sign across various age groups, ensuring that the system provides age-appropriate assessments.\r\n\r\nData Provenance and History Tracking: The ontology captures data provenance, tracking the source and history of observations, which is crucial for clinical decision-making and system transparency.		Mahmoud Ahmed Othman	2024-09-07T00:00:00.000+00:00	https://data.bioontology.org/users/Mahmoud+A+Othman
HOM	Ontology of Homology and Related Concepts in Biology	This ontology represents concepts related to homology, as well as other concepts used to describe similarity and non-homology.	https://bgee.org	Bgee team	2022-01-12T18:06:11.000-08:00	https://data.bioontology.org/users/marcrr
HOME	Health Ontology for Minority Equity	An ontology to record the physical, emotional and psychological effects resulting from differences in treatment that citizens receive based on their identity when entering healthcare institutions. We present the first version of such a Health Ontology for Minority Equity (HOME)		Navya Martin	2022-05-31T00:00:00.000+00:00	https://data.bioontology.org/users/Navya
REPO	Reproductive Trait and Phenotype Ontology	Ontology for livestock reproductive traits and phenotypes		Wageningen UR Livestock Research	2011-10-12T00:00:00.000-07:00	https://data.bioontology.org/users/Ina
CIINTEADO	Ciona intestinalis Anatomy and Development Ontology	 The first ontology describing the anatomy and the development of Ciona intestinalis, based on the Hotta developmental table. 	http://www.aniseed.cnrs.fr/	Delphine Dauga	2015-08-07T00:00:00.000+00:00	https://data.bioontology.org/users/Delphine+DAUGA
PROCCHEMICAL	Chemical Process	Chemical process		Nitin	2016-01-08T00:00:00.000+00:00	https://data.bioontology.org/users/Sun+Pharma
ISO-15926-2_2003	ISO-15926-2_2003_oil	This ontology describes gas and oil field process level descriptions		Nitin	2016-01-08T00:00:00.000+00:00	https://data.bioontology.org/users/Sun+Pharma
BCMO	Breast Cancer-Microbiome Ontology 	The aim of BCMO is to construct a comprehensive and standardized data collection method to study the interaction between the microbiome and breast cancer, including clinical data, pathology, epidemiology, demographic characteristics and lifestyle of breast cancer. Through standardized methods, research results in related research fields can be structured, shareable and comparable. It will contribute to the study of how the microbiome interacts with breast cancer.		Yi Zhou	2024-12-23T00:00:00.000+00:00	https://data.bioontology.org/users/zhouyisic
CCO	Cell Cycle Ontology	An application ontology integrating knowledge about the eukaryotic cell cycle.	http://www.semantic-systems-biology.org/cco/	Vladimir Mironov	2014-06-24T00:00:00.000+00:00	https://data.bioontology.org/users/vlmir
CCON	Cerrado concepts and plant community dynamics	The ontology of Cerrado wood plant dynamics was created in order to represent the set of concepts about the dynamics, that is, changes over time of the wood vegetation structure, of Cerrado. Ccon describes the main parameters used to measure the changes, such as mortality rate and recruitment rate.		Adriano Souza	2014-01-29T00:00:00.000+00:00	https://data.bioontology.org/users/souza.a
GO-EXT	Gene Ontology Extension	Gene Ontology Extension	http://www.geneontology.org	Gene Ontology Consortium	2011-06-24T00:00:00.000-07:00	https://data.bioontology.org/users/admin
HAO	Hymenoptera Anatomy Ontology	A structured controlled vocabulary of the anatomy of the Hymenoptera (bees, wasps, sawflies and ants)	http://hymao.org	HAO developers	2023-06-01T18:12:33.000-07:00	https://data.bioontology.org/users/diapriid%40gmail.com
LDA	Ontology of Language Disorder in Autism	We present the short review of language terms used in the domain of autism and populate them into ontology available for consultation and sharing. The language terms were obtained via text mining and automatic retrieval of terms from the corpus of PubMed abstracts.		Hari Cohly 	2008-12-15T00:00:00.000-08:00	https://data.bioontology.org/users/Kostyuk
SK	Digital Forensic	An abstraction based approach.		sandeepak bhandari	2019-11-28T00:00:00.000+00:00	https://data.bioontology.org/users/sandeepak
SP	SMART Protocols	The SeMAntic RepresenTation for Protocols, SMART Protocols, provides a structured OWL vocabulary of experimental protocols.  SMART Protocols ontology includes two modules, SP-document and SP-workflow. SP-document, aims to provide a structured vocabulary of concepts to represent information necessary and sufficient for reporting an experimental protocol.  SP-Workflow represents: i) the executable  elements of a protocol, protocol instructions; ii) the experimental actions and material entities that participates in instructions (sample/specimen, organisms, reagents, instruments);  and iii) the order of execution of the instructions.	https://smartprotocols.github.io/	Olga Giraldo	2013-07-01T00:00:00.000+00:00	https://data.bioontology.org/users/oxgiraldo
SO	Sequence Types and Features Ontology	SO is a collaborative ontology project for the definition of sequence features used in biological sequence annotation. SO was initially developed by the Gene Ontology Consortium. Contributors to SO include the GMOD community, model organism database groups such as WormBase, FlyBase, Mouse Genome Informatics group, and institutes such as the Sanger Institute and the EBI. Input to SO is welcomed from the sequence annotation community. The OBO revision is available here: http://sourceforge.net/p/song/svn/HEAD/tree/	http://www.sequenceontology.org	SO Administrators	2025-09-11T09:08:55.000-07:00	https://data.bioontology.org/users/keilbeck
METPO	METPO	An ontology of ecophysiological traits of microbes, including tolerated and preferred growth conditions, Microbial ecophysiological trait and phenotype ontology	https://github.com/berkeleybop/metpo	Mark Andrew Miller	2024-01-01T00:00:00.000+00:00	https://data.bioontology.org/users/marcin;https://data.bioontology.org/users/markampa;https://data.bioontology.org/users/cjmungall;https://data.bioontology.org/users/cmungall
INCENTIVE-VARS	INCENTIVE Variables	Controlled vocabularies allow an accurate and controlled approach in describing physical and digital assets (e.g., data). One of such controlled vocabulary is INCENTIVE Variables. This controlled vocabulary is a result of Metadata 4 Machine (M4M) Workshop 18 (M4M.18) provided to the INCENTIVE community (https://zenodo.org/communities/incentive/about/).\r\n\r\nsheet2rdf and OntoStack, developed by FAIR Data Collective, are used to build and serve INCENTIVE Variable, while PURL is used to persist identifiers for the vocabulary terms and properties:\r\n\r\nhttp://purl.org/incentive/variables/	https://github.com/fair-data-collective/M4M18-vocabulary	Nikola Vasiljevic	2023-11-23T18:06:01.000-08:00	https://data.bioontology.org/users/niva
WSIO	Web-Service Interaction Ontology	Web Service Interaction Ontology (WSIO) enables automated interaction with more complex Web services that are typical for example within life sciences. WSIO is however independent of the application domain and relevant for both SOAP and REST Web services, and for batch execution engines in general. If the interaction scenario with a Web service is nontrivial (and incorporates session handling), annotation with WSIO concepts will enable automatic generation of client programs, scripts, or interactive applications with a graphical user interface. WSIO also enables automation of different ways of data transfer and data un-/compression or en-/decoding. We strongly discourage providers from developing complex interaction and data-transfer/compression scenarios, however when needed, WSIO may enable smooth automated interaction with them. Future versions will support more interaction scenarios. WSIO aims to serve also as a means to standardise the complex interaction scenarios primarily within both SOAP and REST Web services, and secondarily to apply also to batch execution infrastructure in general.	http://wsio.org	Matus Kalas	2014-06-19T23:03:00.000-02:00	https://data.bioontology.org/users/mkalas
SOIL-PROF	Soil Profile classifiers	Machine-readable representation of the classifiers described in chapter 8 Soil Profile, by R.C. McDonald and R.F. Isbell, in Australian soil and land survey field handbook (3rd edn).\r\n\r\nA soil profile is a vertical section of a soil from the soil surface through all its horizons to parent material, other consolidated substrate material or selected depth in unconsolidated material.\r\n\r\nThe data was converted from the print representation to this linked-data form by Linda Gregory assisted by Simon J D Cox.	http://registry.it.csiro.au/def/soil/au/asls/soil-prof	Andrew Biggs	2021-04-02T00:00:00.000+00:00	https://data.bioontology.org/users/CSIRO
GFO-BIO	General Formal Ontology for Biology	GFO-Bio is a biological core ontology built on the General Formal Ontology.	http://www.onto-med.de/ontologies/gfo-bio/	Robert Hoehndorf	2010-07-12T00:00:00.000-07:00	https://data.bioontology.org/users/leechuck
CARRE	CARRE Risk Factor ontology	Clinical risk factors, evidence and observables	http://www.carre-project.eu	Allan Third	2014-09-30T00:00:00.000+00:00	https://data.bioontology.org/users/thirda
SHR	Student Health Record Ontology	The goal of SHR project is to develop an ontology for the description of student health records. Student health records are created for entering college students in order to provide better health services will be formed. This file contains various sections such as history of disease, family history of disease, public examinations and ... .	http://www.shojaee.com/shr/	Hassan Shojaee	2011-09-29T00:00:00.000+00:00	https://data.bioontology.org/users/shojaee
VT	Vertebrate Trait Ontology	The Vertebrate Trait Ontology is a controlled vocabulary for the description of traits (measurable or observable characteristics) pertaining to the morphology, physiology, or development of vertebrate organisms.		Cari Park	2025-10-22T00:00:00.000+00:00	https://data.bioontology.org/users/Vertebrate+Trait
VO	Vaccine Ontology	A biomedical ontology in the vaccine domain, The Vaccine Ontology (VO) is a community-based biomedical ontology in the domain of vaccine and vaccination. VO aims to standardize vaccine types and annotations, integrate various vaccine data, and support computer-assisted reasoning. The VO supports basic vaccine R&D and clinical vaccine usage. VO is being developed as a community-based ontology with support and collaborations from the vaccine and bio-ontology communities.	https://github.com/vaccineontology/VO	Yongqunh He	2025-09-09T09:37:27.000-07:00	https://data.bioontology.org/users/yongqunh%40med.umich.edu
RDFS	The RDF Schema vocabulary	RDF Schema provides a data-modelling vocabulary for RDF data		Dan Brickley	2024-12-18T18:14:22.000-08:00	https://data.bioontology.org/users/mmax
LANDFORM	Landform classifiers	Machine-readable representation of the classifiers described in chapter 5 Landform, by J.G. Speight, in Australian soil and land survey field handbook (3rd edn).\r\n\r\nIn this technique for describing landforms, the whole land surface is viewed as a mosaic of tiles of odd shapes and sizes. The scheme is intended to produce a record of observations rather than inferences.\r\n\r\nThe data was converted from the print representation to this linked-data form by Linda Gregory assisted by Simon J D Cox.		Andrew Biggs	2021-04-02T00:00:00.000+00:00	https://data.bioontology.org/users/CSIRO
OPDZIMBABWE	OPDZimbabwe	OPD Terms that are used in Zimbabwe.		Aliya Aktau	2022-01-29T00:00:00.000+00:00	https://data.bioontology.org/users/vodana
OntoVIP	Medical image simulation	The OntoVIP ontology was developed in the context of the Virtual Imaging Platform project (VIP), a french project supported by ANR (ANR-09-COSI-03 grant) aiming at sharing medical image simulation resources. \r\nThis ontology describes the content of the models used in medical image simulation. This ontology can be used to annotate such models in order to highlight the different entities that are present in the 3D scene to be imaged, i.e. anatomical structures, pathological structures, foreign bodies, contrast agents etc. The model allows also to associate to these entities information about their physical qualities, which are used in the medical image simulation process (to mimick physical phenomena involved in CT, MR, US and PET imaging). This ontology partly relies on the OntoNeuroLOG ontology (ONL-DP ONL-MR-DA), as well as PATO, RadLex, FMA and ChEBI.	http://vip.creatis.insa-lyon.fr/ontovip/v1.0/Documentation_OntoVIPv1.pdf	Bernard Gibaud	2013-07-12T00:00:00.000+00:00	https://data.bioontology.org/users/bgibaud
LUNGMAP-HUMAN	Anatomic Ontology for Human Lung Maturation	Anatomic Ontology for Human Lung Maturation (LungMAP Human Anatomy (LMHA)\r\n\r\nDeveloped by Susan E Wert, Gail H. Deutsch, Helen Pan, and the NHLBI Molecular Atlas of Lung Development Program Consortium Ontology Subcommittee	https://www.lungmap.net/breath-ontology-browser/	Huaqin (Helen) Pan	2019-07-30T00:00:00.000+00:00	https://data.bioontology.org/users/hpan67
PAYOR	Payor	This class refers to the entity that made the payment on behalf of the interviewee.		Vinutha Venkatesh	2022-12-07T00:00:00.000+00:00	https://data.bioontology.org/users/VinuthaVenkatesh
DSIPF7	DSIP FiledLab7 	The Human Trafficking Vocabulary is an essential resource for researchers and analysts working with raw interview data gathered from refugees affected by human trafficking. It offers a standardized framework for categorizing and understanding various aspects of human trafficking incidents. The vocabulary includes terms for describing the nationality and location of human traffickers, the number of times traffickers are mentioned by independent sources, the type of observation obtained (first-hand or second-hand), and more.\r\n\r\nThis vocabulary was created as part of Data Science in Practice Fieldlab-7, with guidance from Kai Smiths. It is continuously updated to reflect new insights and developments in the field of human trafficking research.		Senjuti Bala	2023-10-31T00:00:00.000+00:00	https://data.bioontology.org/users/s.bala
ONLIRA	Ontology of Liver for Radiology	ONLIRA (Ontology of the Liver for Radiology) focuses on a semantic specification of imaging observations of CT scans for the liver. ONLIRA extends RadLex with semantic relationships that describe and relate the concepts. Thus, automated processing tasks, such as identifying similar patients, are supported.		neda barzegarmarvasti	2015-01-26T10:18:13.000-08:00	https://data.bioontology.org/users/Burak.Acar;https://data.bioontology.org/users/neda.marvasti
BKO	Bricks ontology	The BricKs Ontology (BKO) provides Systems Biology Graphical Notation representations of recurring concepts in molecular networks. These representations, called bricks, are associated in the ontology with terms describing the concepts. Part of these terms are borrowed from the Gene Ontology and the Systems Biology Ontology. The bricks can be used for both the template-based construction of molecular networks maps as well as for their annotation.	http://sbgnbricks.org	Adrien Rougny	2020-07-21T00:00:00.000+00:00	https://data.bioontology.org/users/arougny
MEDO	Mouse Experimental Design Ontology	A representation of experimental design for high-throughput mouse analysis pipelines.		Helen Parkinson	2012-11-22T00:00:00.000-08:00	https://data.bioontology.org/users/Mouse+Experimental+Design
SDOED	Social Determinants of Education Ontology	Social Determinants of Education Ontology (SDoE) arise from the growing recognition that various factors influence educational outcomes.\r\nEducational success or failure is not solely determined by in-school factors but external factors including social, economic, and environmental influences effect the edcational outcome.\r\ne.g. family income, access to resources, neighborhood, health, and more\r\n		Navya Martin Kollapally	2024-10-13T00:00:00.000+00:00	https://data.bioontology.org/users/Navya
EPISEM	Epilepsy Semiology	An ontology designed to capture the semiology of epilepsy including ictal, post-ictal, inter-ictal, and aura signs.   For the branches entitled "disease", "etiologic factor", "epidemiologic factor"--see ESSO ontology on this website for origin of terms.		Daniel B Hier	2019-11-07T00:00:00.000+00:00	https://data.bioontology.org/users/dbhier
SEDI	Semantic DICOM Ontology	An ontology for DICOM as used in the SeDI project.	https://semantic-dicom.org	https://semantic-dicom.com	2015-06-10T00:00:00.000+00:00	https://data.bioontology.org/users/dgrittner
DCMITYPE	DCMI Type Vocabulary	The DCMI Type Vocabulary provides a general, cross-domain list of approved terms that may be used as values for the Resource Type element to identify the genre of a resource	http://dublincore.org/documents/dcmi-type-vocabulary	Kim Durante	2014-12-02T00:00:00.000+00:00	https://data.bioontology.org/users/kdurante
YUNPING	yunping	yunping ontology test		yunping	2025-04-22T00:00:00.000+00:00	https://data.bioontology.org/users/yunping
