acronym	name	description	homepage	contact	released	administeredBy
NIRS	Non-invasive Respiratory Support Ontology	Managing patients with respiratory failure increasingly involves non-invasive respiratory support (NIRS) as an alternative to traditional ventilation methods. However, despite the rapidly expanding use of NIRS, there is a significant challenge to its best use under all medical circumstances. It lacks a unified ontological structure, complicating guidance on NIRS modalities across healthcare systems. Our goal was to develop an NIRS ontology to support knowledge representation in acute care settings by providing a unified framework that enhances data clarity, interoperability, and clinical decision-making.		Md Fantacher Islam	2025-10-23T00:00:00.000+00:00	https://data.bioontology.org/users/Fantacher
ONTOPSYCARE	Ontology developed during PsyCARE project			Charlet	2025-10-22T00:00:00.000+00:00	https://data.bioontology.org/users/Jean.Charlet
IVAN	IVAN OTERO			IVAN OTERO	2025-10-17T00:00:00.000+00:00	https://data.bioontology.org/users/IVANOTERO
BERVO	The Biological and Environmental Research Variable Ontology	The Biological and Environmental Research Variable Ontology (BERVO) is a model of the experimental variables, conditions, and concepts used in the study of environmental research, including studies in earth science, plant science, and geochemistry.  , None		Harry Caufield	2025-08-05T18:00:28.000-07:00	https://data.bioontology.org/users/caufieldjh
STY1	STY1	TEST STY		nobody	2025-08-14T00:00:00.000+00:00	https://data.bioontology.org/users/alexskr
SHOREBREAK02	shorebreak02	shorebreak02		shorebreak	2025-07-03T00:00:00.000+00:00	https://data.bioontology.org/users/shorebreak002
SHOREBREAK01	shorebreak01	shorebreak01		shorebreak	2025-07-02T00:00:00.000+00:00	https://data.bioontology.org/users/shorebreak002
MWO	NFDI MatWerk Ontology	NFDI-MatWerk aims to establish a digital infrastructure for Materials Science and Engineering (MSE), fostering improved data sharing and collaboration. This repository provides comprehensive documentation for NFDI MatWerk Ontology (MWO) v3.0.0, a foundational framework designed to structure research data and enhance interoperability within the MSE community. To ensure compliance with top-level ontology standards, MWO v3.0.0 is aligned with the Basic Formal Ontology (BFO) and incorporates the modular approach of the NFDIcore mid-level ontology, enriching metadata through standardized classes and properties. The mwo addresses key aspects of MSE research data, including the NFDI-MatWerk community structure, covering task areas, infrastructure use cases, projects, researchers, and organizations. It also describes essential NFDI resources, such as software, workflows, ontologies, publications, datasets, metadata schemas, instruments, facilities, and educational materials. Additionally, mwo represents NFDI-MatWerk services, academic events, courses, and international collaborations. As the foundation for the MSE Knowledge Graph, mwo facilitates efficient data integration and retrieval, promoting collaboration and knowledge representation across MSE domains. This digital transformation enhances data discoverability, reusability, and accelerates scientific exchange, innovation, and discoveries by optimizing research data management and accessibility., The MatWerk ontology represents research data and related activities of the MSE community. The mwo v3 reuses BFO2020 and NFDi core ontologies and focuses on:\nA) Consortium structure: NFDI MatWerk consortium, its structures (task areas, and participant projects), researches, and organizations\nB) NFDI resources: software, data portals, scientific publications, published datasets, and ontologies\nC) NFDI MatWerk services, events, educational cources, and international collabrations\nD) MSE related instruments, materials, processes, and properties.\nFurther infomration can be found at GitHub: https://github.com/ISE-FIZKarlsruhe/mwo		Dr. Hossein Beygi Nasrabadi	2025-03-28T00:00:00.000+00:00	https://data.bioontology.org/users/ho_beygi%40yahoo.com
PHASES	Promoting Health Aging through Semantic Enrichment of Solitude Research	PHASES provides an ontology for integrating research in solitude and gerotranscendence. By integrating these areas of study, we aim to deepen our understanding of each and how they promote healthy aging.		Bill Duncan	2025-07-03T00:00:00.000+00:00	https://data.bioontology.org/users/wdduncan%40gmail.com
ODFA	Ontology of Dental Care-Related Fear and Anxiety	The Ontology of Dental care-related Fear, Anxiety, and/or Phobia (ODFA) contains terms for defining and classifying dental-care related fear, anxiety, and/or phobia (DFA). The ODFA’s concepts and relations facilitate the development of tools and resources capable of enhancing our understanding of the impacts of DFA, and when applied to study data, the ODFA enables the integration and interoperability of data from multiple studies.\r\n\r\nThe ODFA is developed as a subset of the Oral Health and Disease Ontology (http://purl.obolibrary.org/obo/ohd.owl). Issues and new term requests can be submitted at https://github.com/oral-health-and-disease-ontologies/ohd-ontology/issues., the ODFA enables the integration and interoperability of data from multiple studies.\n\nThe ODFA is developed as a subset of the Oral Health and Disease Ontology (http://purl.obolibrary.org/obo/ohd.owl). Issues and new term requests can be submitted at https://github.com/oral-health-and-disease-ontologies/ohd-ontology/issues.		Bill Duncan	2025-09-09T09:21:56.000-07:00	https://data.bioontology.org/users/wdduncan%40gmail.com
BCIO	Behaviour Change Intervention Ontology	The Human Behaviour Change Project (HBCP) funded by the Wellcome Trust, and the Advancing Prevention Research in Cancer through Ontology Tools (APRICOT) Project funded by the US National Institutes of Health, are developing the Behaviour Change Intervention Ontology and associated tools and resources to be used in reporting research; linking datasets and synthesising evidence; and AI/machine learning algorithms to predict intervention outcomes in novel scenarios.\r\n\r\nThe overall aim of these projects is to automate evidence searching, synthesis and interpretation to rapidly address questions from policy-makers, practitioners and others to answer ‘What works, compared with what, how well, with what exposure, with what behaviours (for how long), for whom, in what settings and why?’. To achieve this, ontologies can help structure evidence, i.e., link evidence with a shared formal description of classes and relationships capturing domain knowledge in order to enable aggregation and semantic querying. We are developing and maintaining the Behaviour Change Intervention Ontology (BCIO) to do this.	https://www.humanbehaviourchange.org/	Maya Braun	2025-07-09T00:00:00.000+00:00	https://data.bioontology.org/users/mayabraun;https://data.bioontology.org/users/Janna+Hastings
LTER-CV	LTER Controlled Vocabulary	Duplicate of https://vocab.lternet.edu/vocab/vocab		Gregory Maurer	2025-06-25T00:00:00.000+00:00	https://data.bioontology.org/users/gmaurer
COGITO	Cognitive Task Ontology	CogiTO relates Tasks from Cognitive Atlas to Hierarchical Event Descriptor (HED) tags via logical relationships (as equivalent class axioms) between concepts. In other words, terms for cognitive tasks are defined by their relation to HED tags.\r\nThe purpose of this ontology is to enable querying partially annotated datasets either by a Cognitive Task or by HED tags. 		Bianca Löhnert	2025-06-24T00:00:00.000+00:00	https://data.bioontology.org/users/benhengler
BBO	Biomedical Burden Ontology	The Biomedical Burden Ontology (BBO) is a BFO-aligned OWL ontology for representing and integrating burden-related aspects of patient experience in biomedicine. It models burden as an affective, appraisal-based process that links situations (e.g., symptom, treatment, disease-course, and side-effect processes) to their perceived impacts on goals and expectations, informed by predictive processing/active inference accounts of cognition. BBO reuses and extends MFO, MFOEM, OGMS, and CCO/IAO, and provides patterns to annotate questionnaire-based measurements (e.g., PETS, MTBQ, MDASI), enabling semantic interoperability, automated reasoning, and analysis of burden across research and clinical settings. , The Biomedical Burden Ontology is an ontology of biomedical burdens. It includes support for burden-related entities, such as treatment burden, symptom burden, and burden appraisals.	https://git.soton.ac.uk/meldb/ontologies/	Paul Smart	2025-09-27T18:00:19.000-07:00	https://data.bioontology.org/users/ps02v
VALUESETS	valuesets			Chris Mungall	2025-09-26T00:00:00.000+00:00	https://data.bioontology.org/users/cjmungall
OC_E	OntoCaimer_Examples	This version of ontocaimer contains instantiated examples of patients, sensors, and actuators.\r\nOntoCaimer is an ontology that aims to support the development of systems that support and facilitate the care of Alzheimer's patients. This ontology offers a platform that contains concepts related to the support and management of the symptoms suffered by Alzheimer's patients in each of stage of disease, also encompasses knowledge about sensors, observations and actuators. With these knoledge covered, the proposed system can be used as a knowledge base or as a basis for creating artifacts that can interact with the real world.\r\n		César Pardo	2025-09-25T00:00:00.000+00:00	https://data.bioontology.org/users/ldlasso12
O3	Operational Ontology for Oncology 	The Operational Ontology for Oncology is formalized, machine-readable knowledge representation that defines and standardizes the concepts, terms, value sets and relationships used in cancer care. O3 is an operational ontology, meaning that its format and content is optimized for clinical process implementation with current clinical data systems. It is formed through multi-professional society based, multi-institutional consensus formation with  physicians, physicists, informaticists and other domain experts in the context of the American Association of Physicists in Medicine (AAPM). It is formed in collaboration with and has been endorse by multiple professional societies including American Society of Radiation Oncology (ASTRO), Canadian Association for Radiation Oncology (CARO) and the European Society for Therapeutic Radiation Oncology (ESTRO).    Its primary purpose is to ensure semantic interoperability of comprehensive data sets from disparate sources like electronic health records (EHRs), lab systems, and research databases to be accurately aggregated and understood by different systems. This is particularly crucial for a complex and data-rich field like oncology.  \r\n\r\nO3 was first published in the article, Operational Ontology for Oncology (O3): A Professional Society-Based, Multistakeholder, Consensus-Driven Informatics Standard Supporting Clinical and Research Use of Real-World Data From Patients Treated for Cancer. Int J Radiat Oncol Biol Phys. 2023 Nov 1;117(3):533-550. doi: 10.1016/j.ijrobp.2023.05.033. Epub 2023 May 26. PMID: 37244628; PMCID: PMC10741247.\r\n\r\nThe home web site is at o3standard.net. The site is used as the main mechanism for gathering public comments and accessing future, current and prior versions of the ontology in json format.		Katherine Mayo, PhD	2025-10-16T00:00:00.000+00:00	https://data.bioontology.org/users/kamayo;https://data.bioontology.org/users/csmayo157
NAMO	New Approach Methodology Ontology	The New Approach Methodology Ontology and Schema (NAMO) is a comprehensive data framework designed to standardize and integrate information about alternative methods to animal testing in biomedical research. Built on LinkML, NAMO provides a common vocabulary and data structure for describing diverse model systems, from cellular cultures and organ-on-chip devices to computational models and digital twins.		Chris Mungall	2025-08-20T00:00:00.000+00:00	https://data.bioontology.org/users/cjmungall
ONTONEPHRO	Nephrology Ontology in order to index MOOC			Jean Charlet	2025-09-02T00:00:00.000+00:00	https://data.bioontology.org/users/Jean.Charlet
ROADMAP	Radiology Ontology of AI Models, Datasets and Projects	ROADMAP provides a controlled terminology for the metadata that describe AI models and datasets. It builds on "model cards" and "datasheets for datasets" with imaging-specific descriptors.		Charles Kahn	2025-10-22T00:00:00.000+00:00	https://data.bioontology.org/users/cekahn
SL_DIS	Sleep Disorders 			Ghada Jaouani	2025-08-25T00:00:00.000+00:00	https://data.bioontology.org/users/Ghada+Jaouani
OCS	A Foundational Ontology for Computational Sociology	The history of computational sociology extends over the last 4.5 decades; its roots can perhaps be found in general systems theory and structural functionalism. Ontologies have been created in a wide range of subject areas and their number and application areas are dramatically growing. However, it can be considered quite well-founded to assume that no ontology has been created in the general sociological subject area so far. \r\n\r\nThe OCS (Ontology for Computational Sociology) mentioned in the title makes a modest attempt at this, hoping that true experts in the subject area will end the topic itself (creating and further developing sociological ontologies) interesting. Therefore, let us quote modestly the esteemed Basel mathematician Johann Bernoulli, Opera Omnia, 67, Tom. I.: "Problema novum ad cuius solutionem sociologi invitantur." Keywords Computational sociology; ontology; Java-based application. , The ontology contains 701 classes (BFO-2020: 36, domain: 665) describing essential concepts of sociology	https://www.edithlaszny.eu/	Dr. Edit Hlaszny	2025-10-14T18:11:29.000-07:00	https://data.bioontology.org/users/edithlaszny
JFO	Japanese Food Ontology			Chihiro Higuchi	2025-09-19T00:00:00.000+00:00	https://data.bioontology.org/users/higuchi-nibiohn
SCO-U	Sustainability Core Ontology - Segment U	SCO is a middle-level ontology, representing the major theoretical challenges to sustainability:\r\n1) The polysemy of the term sustainability.\r\n2) The relationship between sustainability and sustainable development.\r\n3) The complexity underlying sustainability.\r\nSCO aims to play a pivotal role in harmonizing and integrating top-level and domain ontologies regarding sustainability., SCO V1.1.0 aligns with two Top-Level Ontologies (TLOs), Basic Formal Ontology (BFO) and Unified Foundational Ontology (UFO). SCO V1.1.0 is comprised of two segments: SCO-B (B for BFO) and SCO-U (U for UFO). SCO-B aligns the SCO vocabulary with BFO (as SCO V1.0.0). SCO-U aligns the SCO vocabulary with gUFO (UFO implementation in the Web Ontology Language (OWL)). This file provides SCO-U segment.\r\n\r\nReferences – TLOs:  \r\nhttps://github.com/BFO-ontology/BFO-2020 \r\nhttps://ontouml.readthedocs.io/en/latest/intro/ufo.html \r\nhttps://nemo-ufes.github.io/gufo/, representing the major theoretical challenges to sustainability:\n1) The polysemy of the term sustainability.\n2) The relationship between sustainability and sustainable development.\n3) The complexity underlying sustainability.\nSCO aims to play a pivotal role in harmonizing and integrating top-level and domain ontologies regarding sustainability., Basic Formal Ontology (BFO) and Unified Foundational Ontology (UFO). SCO V1.1.0 is comprised of two segments: SCO-B (B for BFO) and SCO-U (U for UFO). SCO-B aligns the SCO vocabulary with BFO (as SCO V1.0.0). SCO-U aligns the SCO vocabulary with gUFO (UFO implementation in the Web Ontology Language (OWL)). This file provides SCO-U segment.\n\nReferences – TLOs:  \nhttps://github.com/BFO-ontology/BFO-2020 \nhttps://ontouml.readthedocs.io/en/latest/intro/ufo.html \nhttps://nemo-ufes.github.io/gufo/	https://www.w3id.org/sco/repo	Giorgio A. Ubbiali	2025-10-17T00:00:00.000+00:00	https://data.bioontology.org/users/GioUbbi
GENEVIEVE	Charlotte					https://data.bioontology.org/users/AL-Halafi;https://data.bioontology.org/users/Charlotte
GDCO	Data Collection Ontology	The Data Collection Ontology (DCO) is an ontology designed for data collection providing classes and relations on top of the Basic Formal Ontology (BFO) to facilitate data collection processes, subjects, and data anaylsis through the use of classifiers.\r\n\r\nDCO is based on the notion of reasoning to validate incoming data through their definitions based on classifiers.		Joel Cummings	2017-08-09T00:00:00.000+00:00	https://data.bioontology.org/users/joelcummings
FOAF	Friend of a Friend Vocabulary	Friend of a Friend Vocabulary		Rafael Gonçalves	2019-01-31T00:00:00.000+00:00	https://data.bioontology.org/users/graybeal;https://data.bioontology.org/users/rsgoncalves
OLATDV	Medaka Developmental Stages	Life cycle stages for Medaka. OlatDv is based on the original medaka stage ontology MFO by Thorsten Henrich. Currently it includes only pre-adult stages.	https://github.com/obophenotype/developmental-stage-ontologies/wiki/OlatDv	Chris Mungall	2024-04-03T18:11:07.000+00:00	https://data.bioontology.org/users/vendetti
TM-OTHER-FACTORS	Traditional Medicine Other Factors Value Set	The value set for the Other Factors property of the International Classification of Traditional Medicine (ICTM).	https://sites.google.com/site/whoictm/home	Tania Tudorache	2011-01-31T00:00:00.000-08:00	https://data.bioontology.org/users/tudorachet
RDAO	Rare Diseases Awareness Ontology	The Rare Diseases Awareness Ontology was developed using the Basic Formal Ontology (BFO) framework to support education and awareness processes about rare diseases. It is a semantic data structure that organizes and categorizes specific information about these processes, facilitating access and understanding of the data. This ontology includes key concepts from this domain. Furthermore, it incorporates information to train health professionals, family members, and patients, promoting awareness and more comprehensive education.\r\nThrough data modeling and relationships between these concepts, the ontology allows the creation of interactive and personalized educational resources, in addition to facilitating interoperability between health information systems. With accessible language and visual tools, the system supports disseminating knowledge about rare diseases.\r\nThis study is supported by the São Paulo Research Foundation (FAPESP) as part of the Public Policy Research Program (grant number 2023/10203-8, managed by Domingos Alves). Diego Yamada is also supported by FAPESP (grant number 2024/06751-2).		Yamada, Diego	2024-10-31T00:00:00.000+00:00	https://data.bioontology.org/users/diegoyamada
HFO	Heart Failure Ontology	Heart failure ontology is an attempt to define heart-failure-relevant information including the causes and risk factors, signs and symptoms, diagnostic tests and results, and treatment. 		Liqin Wang	2015-12-08T00:00:00.000+00:00	https://data.bioontology.org/users/liqinwang
GFVO	Genomic Feature and Variation Ontology	The Genomic Feature and Variation Ontology (GFVO) is modeled to represent genomic data using the Resource Description Format (RDF) or Linked Data using JSON (JSON-LD). It is captures the contents of data files that adhere to the Generic Feature Format Version 3 (GFF3, http://www.sequenceontology.org/resources/gff3.html), the General Transfer Format (GTF, http://mblab.wustl.edu/GTF22.html), the Genome Variation Format Version 1 (GVF, http://www.sequenceontology.org/resources/gvf.html), and the Variant Call Format (VCF, http://vcftools.sourceforge.net/specs.html), as well as the FASTA format (http://en.wikipedia.org/wiki/FASTA_format). The creation of the ontology was inspired by previous work of Robert Hoehndorf on RDF2OWL (http://code.google.com/p/rdf2owl).\r\n\r\nNOTE: GFVO in BioPortal is a simplified version without ontology imports and having class/property equivalences removed. The full ontology is available at: http://www.biointerchange.org/gfvo	https://www.codamono.com/biointerchange/	Joachim Baran	2015-07-14T00:00:00.000+00:00	https://data.bioontology.org/users/joachimbaran
G4-DSIP	Group 4-Data Science in Practice	Group 4 Data Science in Practice		Jasper van Mosseveld	2024-01-09T00:00:00.000+00:00	https://data.bioontology.org/users/JaspervM
FISHO	Fish Ontology	This Fish Ontology is an ontology created as how the author views the fish structure following the book "The Diversity of Fishes: Biology, Evolution and Ecology" as the main reference, which covers one part of view on ichthyology, with an emphasis on diversity and adaptation. This ontology is created with the mindset of categorizing fish automatically based on the attributes and terms mined from the fish specimen.\r\n\r\nMost of the basic organization from this ontology follows Nelson's research due to its synthetic and broad approach, while recognizing that Nelson's conclusions are one of many alternative interpretations of the literature, which is mostly agreed by our main references, and many fish and fisheries researchers.\r\n\r\nMost of the classification used in this ontology is in no means completed and just following the recent classification provided by the books\r\n\r\nFor now our work focused more on two group of fish which is early jawless fish, and advanced jawed fishes. The classification from both of this group are structured following the reference.		Mohd Najib	2017-08-28T00:00:00.000+00:00	https://data.bioontology.org/users/23.mohdnajib
SIMON	Simple Measurement Ontology	The SImple Measurement ONtology (SIMON) is a small vocabulary (3 top level classes: PunnedClass, Measurement, and Unit) to represent measurements and units. It uses the pattern to represent N-ary relations and a recursive structure to make the representation of various measurements and units (e.g., "5 kilograms", "4 miles per hour", "5 meters per second per second"  straight forward and obvious. It utilizes the Semantic Web Rule Language (SWRL) to automatically order measurements of the same type (e.g., Speed) regardles of units. E.g., that 5 kilometers per hour is greater than 5 meters per hour. It does this by transforming all measures of a specific type (e.g., distance, mass, speed, acceleration) to canonical units. The canonical units can be modified by changing a few rules. I also include on the github page some SPARQL transformations that generate the rdfs:label for each measurement instance so the developer doesn't have to take the effort and potential error prone risk of doing this manually.  The version included here is the version after the SWRL rules have run and with the inferences exported and also after the SPARQL transforms have generated all the rdfs:label values. Although there are other vocabularies that address this problem they are either much more complex (addressing many additional issues besides units and measures) and/or do not automatically order measures of different units. 	https://github.com/mdebellis/SIMON-A-Simple-Measurement-Vocabulary	Michael DeBellis	2021-05-07T00:00:00.000+00:00	https://data.bioontology.org/users/mdebellis
ADW	Animal Natural History and Life History Ontology	An ontology for animal life history and natural history characteristics suitable for populations and higher taxonomic entities.	http://www.animaldiversity.org	Animal Diversity Web technical staff	2010-08-31T00:00:00.000-07:00	https://data.bioontology.org/users/adw_geeks%40umich.edu
INJURYTYPES	Injury Types	This class is associated with the different injury types.		Vinutha Venkatesh	2022-12-07T00:00:00.000+00:00	https://data.bioontology.org/users/VinuthaVenkatesh
CST	Cancer Staging Terms	This ontology consists of cancer staging terms that specify higher-level terms that are useful in classifying cancer, specifically breast cancer, according to the AJCC 7th and 8th editions.		Oshani Seneviratne	2021-03-08T00:00:00.000+00:00	https://data.bioontology.org/users/oshani
CSTD	Clinical smell and taste disorders	This is an knowledge domain about smell and taste disoders. The aim of this ontology domain is the facilitate high throughput and deep-phenotyping assessment in clinical smell and taste research.		Julien Wen Hsieh	2019-06-07T00:00:00.000+00:00	https://data.bioontology.org/users/Jhsieh01
COLAO	Coleoptera Anatomy Ontology	The Coleoptera Anatomy Ontology contains terms used for describing the anatomy and phenotype of beetles in biodiversity research. It has been built using the Ontology Develoment Kit with the Ontology for the Anatomy of the Insect SkeletoMuscular system (AISM) as a backbone. The project is open for collaboration.	https://github.com/insect-morphology/colao	Jennifer C. Girón	2024-06-28T18:03:12.000+00:00	https://data.bioontology.org/users/jcgiron
GALLONT	Plant Gall Ontology	Ontology of plant gall phenotypes. Plant galls are novel plant structures, generated by plants in response to biotic stressors. This ontology is used to annotate gall phenotypes (e.g., their colors, textures, sizes, locations on the plant) in a semantic way, in order to facilitate discoveries about the genetic and physiologic mechanisms responsible for such phenotypes. The ontology can also be used as a controlled vocabulary for natural language descriptions of plant galls.	https://adeans.github.io/gallont/	Andy Deans	2024-04-19T00:00:00.000+00:00	https://data.bioontology.org/users/vendetti
VIMM	In Vitro Methodologies Ontology for MAATrica metric	MAATrica is a novel metric for assessing the coherence of methodologies in research papers within the fields of medicinal and nutraceutical chemistry. MAATrica employs user-controlled and customizable ontologies (in silico, in vitro and in vivo), enabling personalized analysis of research papers in the fields of medicinal and nutraceutical chemistry. Here we present the in vitro ontology we developed for the scope.		Giulia Panzarella	2024-04-21T00:00:00.000+00:00	https://data.bioontology.org/users/MAATrica
